{
  "schema_version": 1,
  "kind": "recipe",
  "id": "external-qwen-report-20260930-v1",
  "catalog_id": "external-qwen",
  "model": "qwen",
  "hardware": {
    "accelerator": "NVIDIA GB10",
    "nodes": 1,
    "memory_gb_per_node": 128,
    "topology": "single GPU"
  },
  "pins": {},
  "settings": {},
  "requirements": {
    "destination_acceptance_required": true,
    "available_memory_gib_per_node": 100,
    "disk_free": {
      "value": 180,
      "unit": "GB"
    },
    "runtime": "NVIDIA-enabled Docker; serving GPU free of other workloads"
  },
  "source_files": {},
  "unknowns": [
    "Reported configuration is incomplete."
  ],
  "scope": "External report only.",
  "fingerprint": "f430113fcd01d0a4d63a5dc73b717453ddc1c281ab9c6480d108b3f7698b440d"
}
