{
  "schema_version": 1,
  "kind": "recipe",
  "id": "external-glm-report-20260930-v1",
  "catalog_id": "external-glm",
  "model": "glm",
  "hardware": {
    "accelerator": "NVIDIA GB10",
    "nodes": 2,
    "memory_gb_per_node": 128,
    "topology": "tensor parallel pair"
  },
  "pins": {},
  "settings": {
    "dense_precision": "FP8"
  },
  "requirements": {
    "destination_acceptance_required": true,
    "available_memory_gib_per_node": 100,
    "disk_free": {
      "value": 190,
      "unit": "GiB"
    },
    "runtime": "NVIDIA-enabled Docker; serving GPU free of other workloads"
  },
  "source_files": {},
  "unknowns": [
    "Reported configuration is incomplete."
  ],
  "scope": "External report only.",
  "fingerprint": "fb8d873e2f47e15a948ab26baaba59d928c0801dd45737ae302abf5ff2c809c8"
}
